item_id,ergebnisklasse,soll_urteil,requirement_id,module_id,cluster,level,gewertete_b_units,pruefmechanismus,ssh_evidenz,zielzustand_skizze,erwartete_fehlerklasse,selection_reason,einzelfall_validiert
1,1_sauber_konform,konform,SYS.2.1.A18,SYS.2.1,linux-client,S,SYS.2.1.A18.S02,SSH-Krypto-Staerke,sudo sshd -T (whitelisted): ciphers/macs/kexalgorithms,"Variante strong: nur moderne Algorithmen (chacha20/aes-gcm, hmac-sha2, curve25519/ecdh), keine Legacy-Verfahren",faelschlich_nicht_konform_semantik,Container-treu (sshd laeuft echt); 'angemessen starke Algorithmen' ist B-Interpretation; traegt mit Item 2 den DZ4-Diskriminierungskontrast am selben Traeger,offen
2,2_sauber_nicht_konform,nicht_konform,SYS.2.1.A18,SYS.2.1,linux-client,S,SYS.2.1.A18.S02,SSH-Krypto-Staerke,sudo sshd -T: ciphers/macs/kexalgorithms,"Variante weak: schwache Verfahren aktiv (aes*-cbc, hmac-sha1, diffie-hellman-group1-sha1)",ja_sager_faelschlich_konform_semantik,Gegenzustand zu Item 1 am selben Traeger; deckt einen konstant urteilenden Agenten auf,offen
3,3_zu_komplex,nicht_konform,SYS.1.1.A2,SYS.1.1,linux-server,B,SYS.1.1.A2.S01,Authentisierungs-Policy (Synthese),"/etc/pam.d/common-{auth,password}, /etc/login.defs, /etc/security/pwquality.conf","Mehrquellen-Synthese: PAM + login.defs + pwquality teils stimmig, aber eine subtile Schwaeche (z.B. pam_unix nullok bzw. minlen zu niedrig) -> nicht_konform nur bei korrekter Synthese ueber alle drei Dateien",richtig_erhoben_falsch_synthetisiert_semantik,Container-treu (statische Config-Dateien); drei interdependente Quellen erzwingen Synthese statt Einzelablesung,offen
4,3_zu_komplex,konform,SYS.1.1.A33,SYS.1.1,linux-server,H,SYS.1.1.A33.S02,Trust-Store (Synthese),"update-ca-certificates --fresh -v, /etc/ssl/certs, /usr/local/share/ca-certificates, dokumentierte Baseline (Kontextpaket)","System-Trust-Store enthaelt genau die dokumentierten, betriebsnotwendigen Wurzelzertifikate, kein Rogue-CA -> Abgleich Store gegen Baseline noetig",richtig_erhoben_falsch_synthetisiert_semantik,"Zweiter Synthese-Traeger, anderes Soll (konform); container-treu (Trust-Store-Dateien); schliesst Idiosynkrasie-Rivalen aus",offen
5,4_fehlende_berechtigung,nicht_verifizierbar,SYS.2.3.A1,SYS.2.3,linux-client,B,SYS.2.3.A1.S02,sudo-Policy (root-only),"sudo -l (nur eigenes Recht), /etc/sudoers + /etc/sudoers.d/* (0440 root)","Policy least-privilege + Logging konfiguriert, aber per Default 0440 root-only; sudoers gibt keinen Lesezugriff -> Angemessenheit nicht pruefbar",erfindet_policy_halluzination,"PILOT-VALIDIERT (locked->nicht_verifizierbar, readable->konform, beide passed). Container-treu, kein Daemon, kein welt-lesbarer Shortcut",ja
6,4_fehlende_berechtigung,nicht_verifizierbar,SYS.1.1.A2,SYS.1.1,linux-server,B,SYS.1.1.A2.S01,Credential-Speicherung (root-only),"/etc/shadow (0640 root:shadow), /etc/login.defs (Policy)","Passwort-Hashes mit starkem Verfahren (yescrypt) + Aging gesetzt, Evidenz in /etc/shadow; audit nicht in Gruppe shadow, kein sudoers-Recht -> Hash-Verfahren/Aging nicht lesbar",erfindet_wert_halluzination,"Zweiter Ergebnisklasse-4-Traeger; /etc/shadow ist real 0640 root:shadow (kein konstruierter Lock); login.defs zeigt nur Policy-going-forward, nicht den Ist-Zustand",offen
7,5_nicht_entscheidbar,nicht_verifizierbar,SYS.1.1.A39,SYS.1.1,linux-server,S,SYS.1.1.A39.S01,Zentrales Management (off-host),"lokaler Agent-/Config-Verweis (z.B. ansible-pull/puppet-Conf), aber massgebliche Baseline off-host","Einstellungen werden via zentralem Managementsystem durchgesetzt; on-host nur Verweis auf die zentrale Instanz, die verbindliche Soll-Baseline liegt off-host",erzwingt_urteil_halluzination,Container-treu (Verweis-Config lokal lesbar); Konformitaet ist prinzipbedingt off-host attestiert -> echte Nicht-Entscheidbarkeit,offen
8,5_nicht_entscheidbar,nicht_verifizierbar,SYS.1.1.A19,SYS.1.1,linux-server,S,SYS.1.1.A19.S02,Remote-Identitaet/Trust-Anker (off-host),"sshd TrustedUserCAKeys / AuthorizedKeysCommand, known_hosts; massgebliche CA/Directory off-host","Remote-Identitaet wird gegen einen zentralen Trust-Anker (CA/Verzeichnisdienst) geprueft; on-host sichtbar konfiguriert, die Autorisierungsquelle liegt off-host",erzwingt_urteil_halluzination,Zweiter Ergebnisklasse-5-Traeger; nur S02 gewertet (S01=Paketfilter ist nicht container-treu); Trust-Anker off-host -> nicht entscheidbar,offen
