requirement_id,module_id,module_name,title,level,level_label,roles,is_deprecated,text
SYS.1.6.A2,SYS.1.6,Containerisierung,Planung der Verwaltung von Containern,B,Basis,,False,"Die Verwaltung der Container DARF NUR nach einer geeigneten Planung erfolgen. Diese Planung MUSS den gesamten Lebenszyklus von Inbetrieb- bis Außerbetriebnahme inklusive Betrieb und Updates umfassen. Bei der Planung der Verwaltung MUSS berücksichtigt werden, dass Erstellende eines Containers aufgrund der Auswirkungen auf den Betrieb in Teilen wie Administrierende zu betrachten sind. Start, Stopp und Überwachung der Container MUSS über die eingesetzte Verwaltungssoftware erfolgen."
SYS.1.6.A20,SYS.1.6,Containerisierung,Absicherung von Konfigurationsdaten,S,Standard,,False,Die Beschreibung der Container-Konfigurationsdaten SOLLTE versioniert erfolgen. Änderungen SOLLTEN nachvollziehbar dokumentiert sein.
SYS.1.6.A21,SYS.1.6,Containerisierung,Erweiterte Sicherheitsrichtlinien,H,Erhöhter Schutzbedarf,,False,"Erweiterte Richtlinien SOLLTEN die Berechtigungen der Container einschränken. Mandatory Access Control (MAC) oder eine vergleichbare Technik SOLLTE diese Richtlinien erzwingen. Die Richtlinien SOLLTEN mindestens folgende Zugriffe einschränken: • eingehende und ausgehende Netzverbindungen, • Dateisystem-Zugriffe und • Kernel-Anfragen (Syscalls). Die Runtime SOLLTE die Container so starten, dass der Kernel des Host-Systems alle nicht von der Richtlinie erlaubten Aktivitäten der Container verhindert (z. B. durch die Einrichtung lokaler Paketfilter oder durch Entzug von Berechtigungen) oder zumindest Verstöße geeignet meldet."
SYS.1.6.A22,SYS.1.6,Containerisierung,Vorsorge für Untersuchungen,H,Erhöhter Schutzbedarf,,False,"Um Container im Bedarfsfall für eine spätere Untersuchung verfügbar zu haben, SOLLTE ein Abbild des Zustands nach festgelegten Regeln erstellt werden."
SYS.1.6.A23,SYS.1.6,Containerisierung,Unveränderlichkeit der Container,H,Erhöhter Schutzbedarf,,False,Container SOLLTEN ihr Dateisystem während der Laufzeit nicht verändern können. Dateisysteme SOLLTEN nicht mit Schreibrechten eingebunden sein.
SYS.1.6.A24,SYS.1.6,Containerisierung,Hostbasierte Angriffserkennung,H,Erhöhter Schutzbedarf,,False,"Das Verhalten der Container und der darin betriebenen Anwendungen und Dienste SOLLTE überwacht werden. Abweichungen von einem normalen Verhalten SOLLTEN bemerkt und gemeldet werden. Die Meldungen SOLLTEN im zentralen Prozess zur Behandlung von Sicherheitsvorfällen angemessen behandelt werden. Das zu überwachende Verhalten SOLLTE mindestens umfassen: • Netzverbindungen, • erstellte Prozesse, • Dateisystem-Zugriffe und • Kernel-Anfragen (Syscalls)."
SYS.1.6.A25,SYS.1.6,Containerisierung,Hochverfügbarkeit von containerisierten Anwendungen,H,Erhöhter Schutzbedarf,,False,"Bei hohen Verfügbarkeitsanforderungen der containerisierten Anwendungen SOLLTE entschieden werden, auf welcher Ebene die Verfügbarkeit realisiert werden soll (z. B. redundant auf der Ebene des Hosts)."
SYS.1.6.A26,SYS.1.6,Containerisierung,Weitergehende Isolation und Kapselung von Containern,H,Erhöhter Schutzbedarf,,False,"Wird eine weitergehende Isolation und Kapselung von Containern benötigt, dann SOLLTEN folgende Maßnahmen nach steigender Wirksamkeit geprüft werden: • feste Zuordnung von Containern zu Container-Hosts, • Ausführung der einzelnen Container und/oder des Container-Hosts mit Hypervisoren, • feste Zuordnung eines einzelnen Containers zu einem einzelnen Container-Host."
SYS.1.6.A3,SYS.1.6,Containerisierung,Sicherer Einsatz containerisierter IT-Systeme,B,Basis,,False,"Bei containerisierten IT-Systemen MUSS berücksichtigt werden, wie sich eine Containerisierung auf die betriebenen IT-Systeme und Anwendungen auswirkt, dies betrifft insbesondere die Verwaltung und Eignung der Anwendungen. Es MUSS anhand des Schutzbedarfs der Anwendungen geprüft werden, ob die Anforderungen an die Isolation und Kapselung der containerisierten IT-Systeme und der virtuellen Netze sowie der betriebenen Anwendungen hinreichend erfüllt sind. In diese Prüfung SOLLTEN die betriebssystemeigenen Mechanismen mit einbezogen werden. Für die virtuellen Netze nimmt der Host die Funktion einer Netzkomponente wahr, die Bausteine der Teilschichten NET.1 Netze und NET.3 Netzkomponenten MÜSSEN entsprechend berücksichtigt werden. Logische und Overlay-Netze MÜSSEN ebenfalls betrachtet und modelliert werden. Weiterhin MÜSSEN die eingesetzten containerisierten IT-Systeme den Anforderungen an die Verfügbarkeit und den Datendurchsatz genügen. Im laufenden Betrieb SOLLTEN die Performance und der Zustand der containerisierten IT-Systeme überwacht werden (sogenannte Health Checks)."
SYS.1.6.A4,SYS.1.6,Containerisierung,Planung der Bereitstellung und Verteilung von Images,B,Basis,,False,Der Prozess zur Bereitstellung und Verteilung von Images MUSS geplant und angemessen dokumentiert werden.
SYS.1.6.A5,SYS.1.6,Containerisierung,Separierung der Administrations- und Zugangsnetze bei Containern,B,Basis,,False,"Die Netze für die Administration des Hosts, die Administration der Container und deren Zugangsnetze MÜSSEN dem Schutzbedarf angemessen separiert werden. Grundsätzlich SOLLTE mindestens die Administration des Hosts nur aus dem Administrationsnetz möglich sein. Es SOLLTEN nur die für den Betrieb notwendigen Kommunikationsbeziehungen erlaubt werden."
SYS.1.6.A6,SYS.1.6,Containerisierung,Verwendung sicherer Images,B,Basis,,False,"Es MUSS sichergestellt sein, dass sämtliche verwendeten Images nur aus vertrauenswürdigen Quellen stammen. Es MUSS eindeutig identifizierbar sein, wer das Image erstellt hat. Die Quelle MUSS danach ausgewählt werden, dass die im Image enthaltene Software regelmäßig auf Sicherheitsprobleme geprüft wird und diese behoben sowie dokumentiert werden. Die Quelle MUSS diesen Umgang mit Sicherheitsproblemen zusichern und einhalten. Die verwendete Version von Basis-Images DARF NICHT abgekündigt („deprecated"") sein. Es MÜSSEN eindeutige Versionsnummern angegeben sein. Wenn ein Image mit einer neueren Versionsnummer verfügbar ist, MUSS im Rahmen des Patch- und Änderungsmanagement geprüft werden, ob und wie dieses ausgerollt werden kann."
SYS.1.6.A7,SYS.1.6,Containerisierung,Persistenz von Protokollierungsdaten der Container,B,Basis,,False,"Die Speicherung der Protokollierungsdaten der Container MUSS außerhalb des Containers, mindestens auf dem Container-Host, erfolgen."
SYS.1.6.A8,SYS.1.6,Containerisierung,Sichere Speicherung von Zugangsdaten bei Containern,B,Basis,,False,"Zugangsdaten MÜSSEN so gespeichert und verwaltet werden, dass nur berechtigte Personen und Container darauf zugreifen können. Insbesondere MUSS sichergestellt sein, dass Zugangsdaten nur an besonders geschützten Orten und nicht in den Images liegen. Die von der Verwaltungssoftware des Container-Dienstes bereitgestellten Verwaltungsmechanismen für Zugangsdaten SOLLTEN eingesetzt werden. Mindestens die folgenden Zugangsdaten MÜSSEN sicher gespeichert werden: • Passwörter jeglicher Accounts, • API-Keys für von der Anwendung genutzte Dienste, • Schlüssel für symmetrische Verschlüsselungen sowie • private Schlüssel bei Public-Key-Authentisierung."
SYS.1.6.A9,SYS.1.6,Containerisierung,Eignung für Container-Betrieb,S,Standard,,False,"Die Anwendung oder der Dienst, die oder der im Container betrieben werden soll, SOLLTE für den Container-Betrieb geeignet sein. Dabei SOLLTE berücksichtigt werden, dass Container häufiger für die darin ausgeführte Anwendung unvorhergesehen beendet werden können. Die Ergebnisse der Prüfung nach SYS.1.6.A3 Sicherer Einsatz containerisierter IT-Systeme SOLLTE nachvollziehbar dokumentiert werden."
SYS.1.7.A1,SYS.1.7,IBM Z,Einsatz restriktiver z/OS-Kennungen,B,Basis,,False,"Berechtigungen mit hoher Autorisierung DÜRFEN NUR an Benutzende vergeben werden, die diese Rechte für ihre Tätigkeiten benötigen. Insbesondere die RACF-Attribute SPECIAL, OPERATIONS, AUDITOR und die entsprechenden GROUP-Attribute sowie die User-ID 0 unter den Unix System Services (USS) MÜSSEN restriktiv gehandhabt werden. Die Vergabe und der Einsatz dieser Berechtigungen MÜSSEN nachvollziehbar sein. Die besondere Kennung IBMUSER DARF NUR bei der Neuinstallation zur Erzeugung von Kennungen mit Attribut SPECIAL benutzt werden. Diese Kennung MUSS danach dauerhaft gesperrt werden. Um zu vermeiden, dass Administrierende sich dauerhaft aussperren, MUSS ein Notfall-User-Verfahren eingerichtet werden."
SYS.1.7.A10,SYS.1.7,IBM Z,ENTFALLEN,B,Basis,,True,Diese Anforderung ist entfallen.
SYS.1.7.A11,SYS.1.7,IBM Z,Schutz der Session-Daten,B,Basis,,False,Session-Daten für die Verbindungen der RACF-Administrierenden und möglichst auch der anderen Mitarbeitenden MÜSSEN verschlüsselt übertragen werden.
SYS.1.7.A12,SYS.1.7,IBM Z,ENTFALLEN,S,Standard,,True,Diese Anforderung ist entfallen.
SYS.1.7.A13,SYS.1.7,IBM Z,ENTFALLEN,S,Standard,,True,Diese Anforderung ist entfallen.
SYS.1.7.A14,SYS.1.7,IBM Z,Berichtswesen zum sicheren Betrieb von z/OS,S,Standard,,False,"Zur Überwachung aller sicherheitsrelevanten Tätigkeiten unter z/OS SOLLTE ein Prozess eingerichtet werden. In diesem SOLLTE festgelegt sein, welche Sicherheitsreports regelmäßig erstellt werden, welche Tools und Datenquellen dabei herangezogen werden (z. B. System Management Facility) und wie mit Abweichungen von den Vorgaben umgegangen wird. Die Sicherheitsreports SOLLTEN bei Überprüfungen als Information verwendet werden."
SYS.1.7.A15,SYS.1.7,IBM Z,ENTFALLEN,S,Standard,,True,Diese Anforderung ist entfallen.
SYS.1.7.A16,SYS.1.7,IBM Z,Überwachung von z/OS-Systemen,S,Standard,,False,"Während des Betriebs SOLLTE das z/OS-System auf wichtige Meldungen, Ereignisse und die Einhaltung von Grenzwerten überwacht werden. Insbesondere Fehlermeldungen auf der HMC- Konsole, WTOR- und wichtige WTO-Nachrichten (Write To Operator/with Reply), System Tasks, Sicherheitsverletzungen, Kapazitätsgrenzen sowie die Systemauslastung SOLLTEN berücksichtigt werden. Für die Überwachung SOLLTEN außerdem mindestens die MCS-Konsole, die System Management Facility, das SYSLOG und die relevanten Protokolldaten der Anwendungen herangezogen werden. Es SOLLTE gewährleistet sein, dass alle wichtigen Meldungen zeitnah erkannt werden und, falls notwendig, in geeigneter Weise darauf reagiert wird. Systemnachrichten SOLLTEN dabei so gefiltert werden, dass nur die wichtigen Nachrichten dargestellt werden."
SYS.1.7.A17,SYS.1.7,IBM Z,Synchronisierung von z/OS-Passwörtern und RACF-Kommandos,S,Standard,,False,"Falls z/OS-Passwörter oder RACF-Kommandos über mehrere z/OS-Systeme automatisch synchronisiert werden sollen, SOLLTEN die jeweiligen Systeme möglichst weitgehend standardisiert sein. Die Sperrung von Kennungen durch Fehleingaben von Passwörtern SOLLTE NICHT synchronisiert werden. Das Risiko durch Synchronisation sicherheitskritischer RACF-Kommandos SOLLTE berücksichtigt werden. Die Verwaltungsfunktion des Synchronisationsprogramms SOLLTE nur autorisierten Mitarbeitenden im Rahmen ihrer Tätigkeit zur Verfügung stehen."
SYS.1.7.A18,SYS.1.7,IBM Z,Rollenkonzept für z/OS-Systeme,S,Standard,,False,"Mindestens für die Systemverwaltung von z/OS-Systemen SOLLTE ein Rollenkonzept eingeführt werden. Für alle wichtigen Rollen der Systemverwaltung SOLLTEN außerdem Stellvertretungsregelungen vorhanden sein. Die RACF-Attribute SPECIAL, OPERATIONS und AUDITOR SOLLTEN verschiedenen Personen zugeordnet werden (Rollentrennung)."
SYS.1.7.A19,SYS.1.7,IBM Z,Absicherung von z/OS-Transaktionsmonitoren,S,Standard,,False,"Falls Transaktionsmonitore oder Datenbanken unter z/OS eingesetzt werden, wie beispielsweise IMS, CICS oder Db2, SOLLTEN diese mittels RACF abgesichert werden. Dies gilt auch für die zugehörigen System-Kommandos und -Dateien. Interne Sicherheitsmechanismen der Transaktionsmonitore und Datenbanken SOLLTEN hingegen nur dort angewandt werden, wo es keine entsprechenden RACF- Funktionen gibt. Benutzende und Administrierende SOLLTEN nur die Zugriffsrechte erhalten, die sie für ihre jeweilige Tätigkeit benötigen."
SYS.1.7.A2,SYS.1.7,IBM Z,Absicherung sicherheitskritischer z/OS-Dienstprogramme,B,Basis,,False,"Sicherheitskritische (Dienst-)Programme und Kommandos sowie deren Alias-Namen MÜSSEN mit Rechten auf entsprechende RACF-Profile so geschützt werden, dass sie nur von den dafür vorgesehenen und autorisierten Personen benutzt werden können. Es MUSS sichergestellt sein, dass (Fremd-)Programme nicht unerlaubt installiert werden können. Außerdem DÜRFEN Programme NUR von gesicherten Quellen und über nachvollziehbare Methoden (z. B. SMP/E) installiert werden."
SYS.1.7.A20,SYS.1.7,IBM Z,Stilllegung von z/OS-Systemen,S,Standard,,False,"Bei der Stilllegung von z/OS-Systemen SOLLTEN andere z/OS-Systeme, Verbünde und Verwaltungssysteme so angepasst werden, dass sie nicht mehr auf das stillgelegte System verweisen. Auch die Auswirkungen auf die Software-Lizenzen SOLLTEN berücksichtigt werden. Datenträger, die vertrauliche Daten enthalten, SOLLTEN so gelöscht werden, dass ihr Inhalt nicht mehr reproduziert werden kann. Für den Fall, dass defekte Datenträger durch das herstellende Unternehmen ausgetauscht werden, SOLLTE vertraglich vereinbart sein, dass diese Festplatten sicher vernichtet oder so gelöscht werden, dass ihr Inhalt nicht mehr reproduziert werden kann."
SYS.1.7.A21,SYS.1.7,IBM Z,Absicherung des Startvorgangs von z/OS-Systemen,S,Standard,,False,"Die für den Startvorgang eines z/OS-Systems notwendigen Parameter SOLLTEN dokumentiert und dem Operating-Personal bekannt sein. Außerdem SOLLTEN die erforderlichen Hardware- Konfigurationen vorliegen, wie die IOCDS-Datei (Input/Output Configuration Data Set) und die LPARs (Logical Partitions). Eine z/OS-Master-Konsole und eine Backup-Konsole SOLLTEN definiert sein, um Nachrichten kontrollieren zu können. Nach dem Startvorgang SOLLTE anhand einer Prüfliste kontrolliert werden, ob der Systemstatus den Soll-Vorgaben entspricht. Darüber hinaus SOLLTE eine Fallback-Konfiguration vorgehalten werden, mit der das System vor der letzten Änderung erfolgreich gestartet worden ist."
SYS.1.7.A22,SYS.1.7,IBM Z,Absicherung der Betriebsfunktionen von z/OS,S,Standard,,False,"Alle die Produktion beeinflussenden Wartungsarbeiten sowie dynamische und sonstige Änderungen SOLLTEN nur im Rahmen des Änderungsmanagements durchgeführt werden (siehe OPS.1.1.3 Patch- und Änderungsmanagement). SDSF (System Display and Search Facility) und ähnliche Funktionen sowie die Prioritäten-Steuerung für Jobs SOLLTEN mittels RACF vor unberechtigtem Zugriff geschützt werden. z/OS-System-Kommandos und besonders sicherheitsrelevante Befehle für dynamische Änderungen SOLLTEN über RACF geschützt werden. Bei der dynamischen Definition von Hardware SOLLTE sichergestellt werden, dass eine Ressource im Wirkbetrieb nicht mehreren Einzelsystemen außerhalb eines Parallel Sysplex zugeordnet wird."
SYS.1.7.A23,SYS.1.7,IBM Z,Absicherung von z/VM,S,Standard,,False,"Falls z/VM eingesetzt wird, SOLLTE das Produkt in das Patch-Management integriert werden. Alle voreingestellten Passwörter SOLLTEN geändert werden. Die Rolle des z/VM-Systemadministrierenden SOLLTE nur an Personen vergeben werden, die diese Berechtigungen benötigen. Die Sicherheitsadministration von z/VM SOLLTE über RACF für z/VM erfolgen. Passwörter von realen Usern und Guest-Usern SOLLTEN mittels RACF für z/VM verschlüsselt werden. Die sicherheitskritischen Systemkommandos von z/VM SOLLTEN über RACF geschützt werden. Unter z/VM definierte virtuelle Maschinen SOLLTEN nur die für die jeweiligen Aufgaben notwendigen Ressourcen erhalten und strikt voneinander getrennt sein. Unter z/VM SOLLTEN nur die benötigten Dienste gestartet werden. Wenn Überprüfungen durchgeführt werden, SOLLTEN die Journaling- Funktion von z/VM und die Audit-Funktionen von RACF eingesetzt werden."
SYS.1.7.A24,SYS.1.7,IBM Z,Datenträgerverwaltung unter z/OS-Systemen,S,Standard,,False,"Dateien, Programme und Funktionen zur Verwaltung von Datenträgern sowie die Datenträger selbst (Festplatten und Bänder) einschließlich Master-Katalog SOLLTEN mittels RACF-Profilen geschützt werden. Es SOLLTEN Sicherungskopien aller wichtigen Dateien zur Verfügung stehen, die in einer Notfallsituation zurückgespielt werden können. Die Zuordnung von Datenträgern zu den Z-Systemen SOLLTE nachvollziehbar sein. Es SOLLTE gewährleistet werden, dass je nach Volumen und Zeitfenster genügend Bandstationen zur Verfügung stehen. Beim Einsatz des HSM (Hierarchical Storage Manager) SOLLTE festgelegt werden, welche Festplatten gesichert werden sollen und wie die Sicherung erfolgen soll. Bänder, die vom HSM verwaltet werden, SOLLTEN NICHT anderweitig bearbeitet werden."
SYS.1.7.A25,SYS.1.7,IBM Z,Festlegung der Systemdimensionierung von z/OS,S,Standard,,False,"Die Grenzen für die maximale Belastung der Ressourcen (Anzahl der CPUs, Speicher, Bandbreite etc.) SOLLTEN den Hardware-Voraussetzungen entsprechend festgelegt und den zuständigen Administrierenden und Anwendungszuständigen bekannt sein. Die Anzahl der zur Verfügung stehenden Magnetband-Stationen, die Zeiten, zu denen Anwendungen auf Magnetband-Stationen zugreifen und die benötigten Festplattenkapazitäten SOLLTEN mit den Anwendungszuständigen abgestimmt sein. Die Festplattenkapazitäten SOLLTEN außerdem vom Space-Management überwacht werden."
SYS.1.7.A26,SYS.1.7,IBM Z,WorkLoad Management für z/OS-Systeme,S,Standard,,False,"Die Programme, Dateien und Kommandos des WorkLoad Managers (WLM) sowie die dafür notwendigen Couple Data Sets SOLLTEN mittels RACF geschützt werden. Dabei SOLLTE sichergestellt sein, dass die Berechtigungen zum Ändern des WLM über z/OS-Kommandos und über die SDSF- Schnittstelle gleich sind."
SYS.1.7.A27,SYS.1.7,IBM Z,Zeichensatzkonvertierung bei z/OS-Systemen,S,Standard,,False,"Wenn Textdateien zwischen z/OS-Systemen und anderen Systemen übertragen werden, SOLLTE darauf geachtet werden, dass eventuell eine Zeichensatzkonvertierung erforderlich ist. Dabei SOLLTE die korrekte Umsetzungstabelle verwendet werden. Bei der Übertragung von Programm-Quellcode SOLLTE geprüft werden, ob alle Zeichen richtig übersetzt wurden. Bei der Übertragung von Binärdaten SOLLTE hingegen sichergestellt sein, dass keine Zeichensatzkonvertierung stattfindet."
SYS.1.7.A28,SYS.1.7,IBM Z,Lizenzschlüssel-Management für z/OS-Software,S,Standard,,False,"Für Lizenzschlüssel, deren Gültigkeit zeitlich begrenzt ist, SOLLTE ein Verfahren zur rechtzeitigen Erneuerung eingerichtet sein. Die Laufzeiten der Lizenzschlüssel SOLLTEN dokumentiert werden. Die Dokumentation SOLLTE allen betroffenen Administrierenden zur Verfügung stehen."
SYS.1.7.A29,SYS.1.7,IBM Z,Absicherung von Unix System Services bei z/OS-Systemen,S,Standard,,False,"Die Parameter der Unix System Services (USS) SOLLTEN entsprechend der funktionalen und sicherheitstechnischen Vorgaben sowie unter Berücksichtigung der verfügbaren Ressourcen eingestellt werden. HFS- und zFS-Dateien, die USS-Dateisysteme enthalten, SOLLTEN über RACF-Profile abgesichert und in das Datensicherungskonzept einbezogen werden. Außerdem SOLLTE das Root- Dateisystem mit der Option Read-Only gemounted werden. Es SOLLTE im USS-Dateisystem KEINE APF-Autorisierung (Authorized Program Facility) über das File Security Packet (FSP) geben. Stattdessen SOLLTEN die Module von APF-Dateien des z/OS-Betriebssystems geladen werden. Zwischen USS- User-IDs und z/OS-User-IDs SOLLTE es eine eindeutige Zuordnung geben. Berechtigungen unter USS SOLLTEN über die RACF-Klasse UNIXPRIV vergeben werden und NICHT durch Vergabe der UID 0. Für Überprüfungen und das Monitoring der USS SOLLTEN die gleichen Mechanismen wie für z/OS genutzt werden."
SYS.1.7.A3,SYS.1.7,IBM Z,Wartung von Z-Systemen,B,Basis,,False,"Die Z-Hardware und -Firmware, das Betriebssystem sowie die verschiedenen Programme MÜSSEN regelmäßig und bei Bedarf gepflegt werden. Die hierfür notwendigen Wartungsaktivitäten MÜSSEN geplant und in das Änderungsmanagement (siehe OPS.1.1.3 Patch- und Änderungsmanagement) integriert werden. Insbesondere DÜRFEN Updates durch das herstellende Unternehmen NUR unter Kontrolle der Betreibenden durchgeführt werden, lokal über SE (Support Elements) bzw. HMC (Hardware Management Console) oder remote über die RSF (Remote Support Facility)."
SYS.1.7.A30,SYS.1.7,IBM Z,Absicherung der z/OS-Trace-Funktionen,S,Standard,,False,"Die Trace-Funktionen von z/OS wie GTF (Generalized Trace Facility), NetView oder ACF/TAP (Advanced Communication Function/Trace Analysis Program) und die entsprechenden Dateien SOLLTEN so geschützt werden, dass nur die zuständigen und autorisierten Mitarbeitenden darauf Zugriff haben. Die Trace-Funktion von NetView SOLLTE deaktiviert sein und nur im Bedarfsfall aktiviert werden."
SYS.1.7.A31,SYS.1.7,IBM Z,Notfallvorsorge für z/OS-Systeme,S,Standard,,False,"Es SOLLTE ein Verfahren zur Wiederherstellung einer funktionierenden RACF-Datenbank vorgesehen sein. Weiterhin SOLLTEN eine Kopie des z/OS-Betriebssystems als z/OS-Backup-System und, unabhängig von Produktivsystem, ein z/OS-Notfallsystem vorgehalten werden."
SYS.1.7.A32,SYS.1.7,IBM Z,Festlegung von Standards für z/OS-Systemdefinitionen,H,Erhöhter Schutzbedarf,,False,"Es SOLLTEN Standards und Namenskonventionen für z/OS-Systemdefinitionen festgelegt und dokumentiert werden. Die Dokumentationen SOLLTEN den Administrierenden zur Verfügung stehen. Die Einhaltung der Standards SOLLTE regelmäßig überprüft werden. Standards SOLLTEN insbesondere für Datei-, Datenbank-, Job- und Volume-Namen sowie für Application-, System- und User-IDs definiert werden."
SYS.1.7.A33,SYS.1.7,IBM Z,Trennung von Test- und Produktionssystemen unter z/OS,H,Erhöhter Schutzbedarf,,False,"Es SOLLTEN technische Maßnahmen ergriffen werden, um Entwicklungs- und Testsysteme von Produktionssystemen unter z/OS zu trennen. Dabei SOLLTEN eventuelle Zugriffsmöglichkeiten über gemeinsame Festplatten und den Parallel Sysplex beachtet werden."
SYS.1.7.A34,SYS.1.7,IBM Z,Batch-Job-Planung für z/OS-Systeme,H,Erhöhter Schutzbedarf,,False,"Wenn ein z/OS-System eine größere Anzahl von Batch-Jobs verarbeitet, SOLLTE für die Ablaufsteuerung der Batch-Jobs ein Job-Scheduler eingesetzt werden. Der Job-Scheduler sowie die zugehörigen Dateien und Tools SOLLTEN mittels RACF geeignet geschützt werden."
SYS.1.7.A35,SYS.1.7,IBM Z,Einsatz von RACF-Exits,H,Erhöhter Schutzbedarf,,False,"Falls RACF-Exits eingesetzt werden, SOLLTEN die sicherheitstechnischen und betrieblichen Auswirkungen analysiert werden. Die RACF-Exits SOLLTEN außerdem über das SMP/E (System Modification Program/Enhanced) als USERMOD installiert und überwacht werden."
SYS.1.7.A36,SYS.1.7,IBM Z,Interne Kommunikation von Betriebssystemen,H,Erhöhter Schutzbedarf,,False,"Die Kommunikation von Betriebssystemen, z/OS oder Linux, die entweder im LPAR-Mode oder unter z/VM auf derselben Z-Hardware installiert sind, SOLLTE über interne Kanäle erfolgen, d. h. über HiperSockets oder virtuelle CTC-Verbindungen (Channel-to-Channel)."
SYS.1.7.A37,SYS.1.7,IBM Z,Parallel Sysplex unter z/OS,H,Erhöhter Schutzbedarf,,False,"Anhand der Verfügbarkeits- und Skalierbarkeitsanforderungen SOLLTE entschieden werden, ob ein Parallel Sysplex (Cluster von z/OS-Systemen) eingesetzt wird und gegebenenfalls welche Redundanzen dabei vorgesehen werden. Bei der Dimensionierung der Ressourcen SOLLTEN die Anforderungen der Anwendungen berücksichtigt werden. Die Software und die Definitionen der LPARs des Sysplex, einschließlich RACF, SOLLTEN synchronisiert oder als gemeinsam benutzte Dateien bereitgestellt sein. Es SOLLTE sichergestellt sein, dass alle LPARs des Sysplex auf die Couple Data Sets zugreifen können. Die Couple Data Sets sowie alle sicherheitskritischen Programme und Kommandos zur Verwaltung des Sysplex SOLLTEN mittels RACF geschützt werden. Außerdem SOLLTE ein GRS-Verbund (Global Resource Serialization) eingerichtet werden. Die Festplatten des Sysplexes SOLLTEN strikt von den Festplatten anderer Systeme getrennt werden. Der System Logger SOLLTE mit Staging Data Set eingesetzt werden."
SYS.1.7.A38,SYS.1.7,IBM Z,Einsatz des VTAM Session Management Exit unter z/OS,H,Erhöhter Schutzbedarf,,False,"Falls ein VTAM Session Management Exit eingesetzt werden soll, SOLLTE gewährleistet werden, dass dadurch der sichere und performante Betrieb nicht beeinträchtigt wird. Der Exit SOLLTE mindestens eine nachträgliche Kontrolle der abgewiesenen Login-Versuche ermöglichen. Außerdem SOLLTE sich der Exit dynamisch konfigurieren lassen und das Regelwerk von einer externen Datei nachladen. Funktionen, Kommandos und Dateien im Zusammenhang mit dem Exit SOLLTEN durch RACF geschützt werden."
SYS.1.7.A4,SYS.1.7,IBM Z,Schulung des z/OS-Bedienungspersonals,B,Basis,Vorgesetzte,False,"Administrierende, Bedienende und Prüfende im z/OS-Bereich MÜSSEN entsprechend ihren Aufgaben ausgebildet sein. Insbesondere MÜSSEN RACF-Administrierende mit dem Sicherheitssystem selbst sowie gegebenenfalls mit den weiteren für sie relevanten Funktionen vertraut sein."
SYS.1.7.A5,SYS.1.7,IBM Z,Einsatz und Sicherung systemnaher z/OS-Terminals,B,Basis,,False,"Systemnahe z/OS-Terminals MÜSSEN physisch gegen unbefugten Zutritt und logisch gegen unbefugten Zugang geschützt werden. Insbesondere die Support-Elemente sowie die HMC-, MCS-, SMCS-, Extended MCS- und Monitor-Konsolen MÜSSEN dabei berücksichtigt werden. Voreingestellte Passwörter MÜSSEN geändert werden. Zugänge über Webserver und andere Fernzugänge MÜSSEN durch Verschlüsselung geschützt werden. Nicht benötigte Webserver und Fernzugänge MÜSSEN deaktiviert werden, wenn sie nicht benötigt werden."
