requirement_id,module_id,module_name,title,level,level_label,roles,is_deprecated,text
SYS.3.2.3.A18,SYS.3.2.3,iOS (for Enterprise),Verwendung der Konfigurationsoption für den Browser Safari,S,Standard,,False,Die bereits in der Institution etablierten Browserrichtlinien SOLLTEN entsprechend auch für Safari durch technische und organisatorische Maßnahmen umgesetzt werden. Dabei SOLLTEN die bereits etablierten Anforderungen für Browser auf stationären und tragbaren PCs als Grundlage für die Absicherung der iOS-basierten Geräte dienen sowie die Einsatzszenarien. Das Einsatzumfeld der Geräte SOLLTE beachtet werden.
SYS.3.2.3.A19,SYS.3.2.3,iOS (for Enterprise),ENTFALLEN,S,Standard,,True,Diese Anforderung ist entfallen.
SYS.3.2.3.A2,SYS.3.2.3,iOS (for Enterprise),Planung des Einsatzes von Cloud-Diensten,B,Basis,,False,"Bevor iOS-basierte Geräte verwendet werden, MUSS festgelegt werden, welche Cloud-Services in welchem Umfang genutzt werden sollen bzw. dürfen. Dabei SOLLTE berücksichtigt werden, dass iOS- basierte Geräte grundsätzlich eng mit iCloud-Diensten von Apple verzahnt sind. Außerdem SOLLTE berücksichtigt werden, dass beispielsweise bereits die Aktivierung von Einzelgeräten mit einer Apple- ID hiervon betroffen ist. Daher SOLLTE geprüft werden, ob zur Geräteregistrierung Apple Business Manager (früher Device Enrollment Program, DEP) genutzt werden kann."
SYS.3.2.3.A20,SYS.3.2.3,iOS (for Enterprise),ENTFALLEN,S,Standard,,True,Diese Anforderung ist entfallen.
SYS.3.2.3.A21,SYS.3.2.3,iOS (for Enterprise),Installation von Apps und Einbindung des Apple App Stores,S,Standard,,False,"Um sicherzustellen, dass den autorisierten Benutzenden die benötigten Apps zum notwendigen Zeitpunkt ausreichend zur Verfügung stehen, SOLLTE überlegt werden, den Apple Business Manager in die MDM-Infrastruktur zu integrieren. Zahlungen im App Store SOLLTE NICHT über biometrische Verfahren bestätigt werden."
SYS.3.2.3.A22,SYS.3.2.3,iOS (for Enterprise),ENTFALLEN,H,Erhöhter Schutzbedarf,,True,Diese Anforderung ist entfallen.
SYS.3.2.3.A23,SYS.3.2.3,iOS (for Enterprise),Verwendung der automatischen Konfigurationsprofillöschung,H,Erhöhter Schutzbedarf,,False,"Geräte, die über einen klar definierten Zeitraum durchgängig offline sind, SOLLTEN ihren Zugang zur internen Infrastruktur verlieren. Nach Ablauf des definierten Zeitraums oder an einem bestimmten Tag, SOLLTE das Konfigurationsprofil ohne Zutun des IT-Betriebs gelöscht werden. Falls Benutzende des Geräts vor Ablauf der Frist auf das interne Netz zugreift, SOLLTE der Zeitraum bis zur automatischen Löschung des Konfigurationsprofils erneuert werden. Falls sicherzustellen ist, ob die Benutzenden noch im Besitz ihres Gerätes sind, SOLLTEN sie aktiv zum Zugriff innerhalb einer Frist aufgefordert werden. Falls die Frist ohne Zugriff verstreicht, sollte das Konfigurationsprofil der entsprechenden Benutzenden automatisch gelöscht werden."
SYS.3.2.3.A24,SYS.3.2.3,iOS (for Enterprise),ENTFALLEN,H,Erhöhter Schutzbedarf,,True,Diese Anforderung ist entfallen.
SYS.3.2.3.A25,SYS.3.2.3,iOS (for Enterprise),Verwendung der Konfigurationsoption für AirPrint,H,Erhöhter Schutzbedarf,,False,"Freigegebene AirPrint-Drucker SOLLTEN den Benutzenden durch ein Konfigurationsprofil bereitgestellt werden. Um zu vermeiden, dass Informationen auf nicht vertrauenswürdigen Druckern von Benutzenden ausgedruckt werden können, SOLLTEN stets alle Kommunikationsverbindungen über die Infrastruktursysteme der Institution geführt werden."
SYS.3.2.3.A26,SYS.3.2.3,iOS (for Enterprise),Keine Verbindung mit Host-Systemen,H,Erhöhter Schutzbedarf,,False,"Um zu vermeiden, dass iOS-basierte Geräte unautorisiert mit anderen IT-Systemen verbunden werden, SOLLTEN die Benutzenden iOS-basierte Geräte ausschließlich mit dem MDM verbinden können."
SYS.3.2.3.A27,SYS.3.2.3,iOS (for Enterprise),ENTFALLEN,H,Erhöhter Schutzbedarf,,True,Diese Anforderung ist entfallen.
SYS.3.2.3.A3,SYS.3.2.3,iOS (for Enterprise),ENTFALLEN,B,Basis,,True,Diese Anforderung ist entfallen.
SYS.3.2.3.A4,SYS.3.2.3,iOS (for Enterprise),ENTFALLEN,B,Basis,,True,Diese Anforderung ist entfallen.
SYS.3.2.3.A5,SYS.3.2.3,iOS (for Enterprise),ENTFALLEN,B,Basis,,True,Diese Anforderung ist entfallen.
SYS.3.2.3.A6,SYS.3.2.3,iOS (for Enterprise),ENTFALLEN,B,Basis,,True,Diese Anforderung ist entfallen.
SYS.3.2.3.A7,SYS.3.2.3,iOS (for Enterprise),Verhinderung des unautorisierten Löschens von Konfigurationsprofilen,B,Basis,,False,"Damit Konfigurationsprofile nicht unautorisiert gelöscht werden können, MÜSSEN geeignete technische (z. B. durch den betreuten Modus) oder organisatorische Maßnahmen getroffen und umgesetzt werden. Benutzende von mobilen Endgeräten SOLLTEN für den Sinn und Zweck der Sicherheitsmaßnahmen sensibilisiert werden."
SYS.3.2.3.A8,SYS.3.2.3,iOS (for Enterprise),ENTFALLEN,B,Basis,,True,Diese Anforderung ist entfallen.
SYS.3.2.3.A9,SYS.3.2.3,iOS (for Enterprise),ENTFALLEN,S,Standard,,True,Diese Anforderung ist entfallen.
SYS.3.2.4.A1,SYS.3.2.4,Android,ENTFALLEN,B,Basis,,True,Diese Anforderung ist entfallen.
SYS.3.2.4.A2,SYS.3.2.4,Android,Deaktivieren des Entwicklermodus,S,Standard,,False,In allen Android-basierten Geräten SOLLTE der Entwicklermodus deaktiviert sein.
SYS.3.2.4.A3,SYS.3.2.4,Android,Einsatz des Multi-User- und Gäste-Modus,S,Standard,,False,"Es SOLLTE geregelt sein, ob ein Gerät mit anderen Personen geteilt werden darf. Es SOLLTE festgelegt werden, ob dazu der Multi-User- oder Gäste-Modus verwendet werden muss. Benutzende auf einem Android-basierten Gerät SOLLTEN natürliche Personen sein."
SYS.3.2.4.A4,SYS.3.2.4,Android,ENTFALLEN,S,Standard,,True,Diese Anforderung ist entfallen.
SYS.3.2.4.A5,SYS.3.2.4,Android,Erweiterte Sicherheitseinstellungen,S,Standard,,False,"Es SOLLTEN nur freigegebene Sicherheits-Apps Rechte zur Geräteadministration bekommen oder sich als „Trust Agents“ eintragen lassen. Dies SOLLTE regelmäßig überprüft werden. Weiterhin SOLLTE es nur erlaubten Apps möglich sein, auf Nutzungsdaten und auf Benachrichtigungen zuzugreifen."
SYS.3.2.4.A6,SYS.3.2.4,Android,ENTFALLEN,H,Erhöhter Schutzbedarf,,True,Diese Anforderung ist entfallen.
SYS.3.2.4.A7,SYS.3.2.4,Android,ENTFALLEN,H,Erhöhter Schutzbedarf,,True,Diese Anforderung ist entfallen.
SYS.3.3.A1,SYS.3.3,Mobiltelefon,Sicherheitsrichtlinien und Regelungen für die Nutzung von Mobiltelefonen,B,Basis,,False,"Im Hinblick auf die Nutzung und Kontrolle der Geräte MUSS eine Sicherheitsrichtlinie erstellt werden. Jeder benutzenden Person eines Mobiltelefons MUSS ein Exemplar der Sicherheitsrichtlinie ausgehändigt werden. Es MUSS regelmäßig überprüft werden, ob die Sicherheitsrichtlinie eingehalten wird. Die Sicherheitsrichtlinie zur dienstlichen Nutzung von Mobiltelefonen SOLLTE Bestandteil der Schulung zu Sicherheitsmaßnahmen sein."
SYS.3.3.A10,SYS.3.3,Mobiltelefon,Sichere Datenübertragung über Mobiltelefone,S,Standard,Benutzende,False,"Es SOLLTE geregelt sein, welche Daten über Mobiltelefone übertragen werden dürfen. Die dafür erlaubten Schnittstellen SOLLTEN festgelegt werden. Außerdem SOLLTE beschlossen werden, wie die Daten bei Bedarf zu verschlüsseln sind."
SYS.3.3.A11,SYS.3.3,Mobiltelefon,Ausfallvorsorge bei Mobiltelefonen,S,Standard,Benutzende,False,"Die auf einem Mobiltelefon gespeicherten Daten SOLLTEN in regelmäßigen Abständen auf einem externen Medium gesichert werden. Muss ein defektes Mobiltelefon repariert werden, SOLLTEN zuvor alle Daten gelöscht und das Gerät auf den Werkszustand zurückgesetzt werden. Es SOLLTEN immer Ersatzgeräte vorhanden sein, um ein ausgefallenes Mobiltelefon kurzfristig ersetzen zu können."
SYS.3.3.A12,SYS.3.3,Mobiltelefon,Einrichtung eines Mobiltelefon-Pools,S,Standard,,False,"Bei häufig wechselnden Benutzenden dienstlicher Mobiltelefone SOLLTE eine Sammelaufbewahrung (Pool) eingerichtet werden. Die Ausgabe und Rücknahme von Mobiltelefonen und Zubehör SOLLTE dokumentiert werden. Vor der Ausgabe SOLLTE sichergestellt werden, dass die Mobiltelefone aufgeladen und mit den nötigen Programmen und Daten für die neuen Besitzenden ausgestattet sind. Zudem SOLLTEN die Benutzenden auf die Einhaltung der Sicherheitsleitlinie hingewiesen werden. Nachdem die Geräte wieder zurückgegeben wurden, SOLLTEN sie auf den Werkszustand zurückgesetzt werden."
SYS.3.3.A13,SYS.3.3,Mobiltelefon,Schutz vor der Erstellung von Bewegungsprofilen bei der Nutzung von Mobilfunk,H,Erhöhter Schutzbedarf,Benutzende,False,"Es SOLLTE geklärt werden, ob sich die Erstellung von Bewegungsprofilen durch Dritte negativ auswirken kann oder als Problem angesehen wird. Um eine Ortung über GPS zu verhindern, SOLLTE diese Funktion abgeschaltet werden. Falls eine Ortung über das Mobilfunknetz verhindert werden soll, SOLLTE das Mobiltelefon abgeschaltet und der Akku entfernt werden."
SYS.3.3.A14,SYS.3.3,Mobiltelefon,Schutz vor Rufnummernermittlung bei der Nutzung von Mobiltelefonen,H,Erhöhter Schutzbedarf,Benutzende,False,"Um zu verhindern, dass die verwendeten Rufnummern bestimmten Personen zugeordnet werden können, SOLLTEN Rufnummern für ausgehende Anrufe unterdrückt werden. Außerdem SOLLTEN KEINE SMS- und MMS-Nachrichten versendet werden. Rufnummern von Mobiltelefonen SOLLTEN NICHT veröffentlicht oder an unbefugte Dritte weitergegeben werden."
SYS.3.3.A15,SYS.3.3,Mobiltelefon,Schutz vor Abhören der Raumgespräche über Mobiltelefone,H,Erhöhter Schutzbedarf,,False,"Damit vertrauliche Informationen nicht abgehört werden können, SOLLTE dafür gesorgt werden, dass keine Mobiltelefone zu vertraulichen Besprechungen und Gesprächen in die entsprechenden Räume mitgenommen werden. Falls erforderlich, SOLLTE das Mitführungsverbot durch Mobilfunk- Detektoren überprüft werden."
SYS.3.3.A2,SYS.3.3,Mobiltelefon,Sperrmaßnahmen bei Verlust eines Mobiltelefons,B,Basis,Benutzende,False,"Bei Verlust eines Mobiltelefons MUSS die darin verwendete SIM-Karte zeitnah gesperrt werden. Falls möglich, SOLLTEN vorhandene Mechanismen zum Diebstahlschutz, wie Fernlöschung oder -sperrung, genutzt werden. Alle notwendigen Informationen zur Sperrung von SIM-Karte und Mobiltelefon MÜSSEN unmittelbar griffbereit sein."
SYS.3.3.A3,SYS.3.3,Mobiltelefon,Sensibilisierung und Schulung der Mitarbeitenden im Umgang mit Mobiltelefonen,B,Basis,,False,"Mitarbeitende MÜSSEN für die besonderen Gefährdungen der Informationssicherheit durch Mobiltelefone sensibilisiert werden. Sie MÜSSEN in die Sicherheitsfunktion der Mobiltelefone eingewiesen sein. Den Benutzenden MUSS der Prozess bekannt sein, durch den die Mobiltelefone gesperrt werden können. Die Benutzenden MÜSSEN darauf hingewiesen werden, wie die Mobiltelefone sicher und korrekt aufbewahrt werden sollten."
SYS.3.3.A4,SYS.3.3,Mobiltelefon,Aussonderung und ordnungsgemäße Entsorgung von Mobiltelefonen und darin verwendeter Speicherkarten,B,Basis,,False,"Mobiltelefone MÜSSEN vor der Entsorgung auf den Werkszustand zurückgesetzt werden. Es MUSS überprüft werden, ob alle Daten gelöscht wurden. Es SOLLTE zudem sichergestellt werden, dass die Mobiltelefone und eventuell darin verwendete Speicherkarten ordnungsgemäß entsorgt werden. Falls die Mobiltelefone und Speicherkarten erst zu einem späteren Zeitpunkt beziehungsweise in größerer Anzahl entsorgt werden, MÜSSEN die gesammelten Mobiltelefone und Speicherkarten vor unberechtigtem Zugriff geschützt werden."
SYS.3.3.A5,SYS.3.3,Mobiltelefon,Nutzung der Sicherheitsmechanismen von Mobiltelefonen,S,Standard,Benutzende,False,"Die verfügbaren Sicherheitsmechanismen SOLLTEN auf den Mobiltelefonen genutzt und vorkonfiguriert werden. Die SIM-Karte SOLLTE durch eine sichere PIN geschützt werden. Die Super- PIN/PUK SOLLTE nur im Rahmen der definierten Prozesse von den Zuständigen benutzt werden. Das Mobiltelefon SOLLTE durch einen Geräte-Code geschützt werden. Falls möglich, SOLLTE das Gerät an die SIM-Karte gebunden werden (SIM-Lock)."
SYS.3.3.A6,SYS.3.3,Mobiltelefon,Updates von Mobiltelefonen,S,Standard,Benutzende,False,"Es SOLLTE regelmäßig geprüft werden, ob es Softwareupdates für die Mobiltelefone gibt. Der Umgang mit Updates SOLLTE geregelt werden. Wenn es neue Softwareupdates gibt, SOLLTE festgelegt werden, wie die Benutzenden darüber informiert werden. Es SOLLTE festgelegt werden, ob die Benutzenden die Updates selber installieren dürfen, oder ob die Mobiltelefone an einer zentralen Stelle hierfür abgegeben werden sollen."
SYS.3.3.A7,SYS.3.3,Mobiltelefon,Beschaffung von Mobiltelefonen,S,Standard,,False,"Bevor Mobiltelefone beschafft werden, SOLLTE eine Anforderungsliste erstellt werden. Anhand der Anforderungsliste SOLLTEN die am Markt erhältlichen Produkte bewertet werden. Das Produkt SOLLTE danach ausgewählt werden, ob die Herstellenden für den geplanten Einsatzzeitraum Updates anbieten. Es SOLLTE gewährleistet werden, dass Ersatzteile wie Akkus und Ladegeräte in ausreichender Qualität nachbeschafft werden können."
SYS.3.3.A8,SYS.3.3,Mobiltelefon,Nutzung drahtloser Schnittstellen von Mobiltelefonen,S,Standard,Benutzende,False,"Drahtlose Schnittstellen von Mobiltelefonen wie IrDA, WLAN oder Bluetooth SOLLTEN deaktiviert werden, solange sie nicht benötigt werden."
SYS.3.3.A9,SYS.3.3,Mobiltelefon,Sicherstellung der Energieversorgung von Mobiltelefonen,H,Erhöhter Schutzbedarf,Benutzende,False,"Es SOLLTEN angemessene Maßnahmen getroffen werden, um die dauerhafte Energieversorgung von Mobiltelefonen sicherzustellen. Je nach Bedarf SOLLTEN Wechselakkus oder Powerbanks eingesetzt werden."
SYS.4.1.A1,SYS.4.1,"Drucker, Kopierer und","Planung des Einsatzes von Druckern, Kopierern und Multifunktionsgeräten",B,Basis,,False,"Bevor Drucker, Kopierer und Multifunktionsgeräte beschafft werden, MUSS der sichere Einsatz geplant werden. Dabei SOLLTEN folgende Kriterien berücksichtigt werden: • Unterstützung sicherer Protokolle zur Datenübertragung und Administration, • Verschlüsselung der abgespeicherten Informationen, • Authentisierung der Benutzenden direkt am Gerät, • Nutzung physischer Schutzmechanismen, wie Ösen zum Diebstahlschutz oder Geräteschlösser, • Existenz eines zuverlässigen und leistungsfähigen automatischen Seiteneinzugs der Scaneinheit, • Unterstützung geeigneter Datenformate, • Bei Bedarf Unterstützung von Patch- sowie Barcodes zur Dokumententrennung und Übergabe von Metainformationen, • Existenz einer Funktion zum sicheren Löschen des Speichers sowie • Verfügbarkeit von regelmäßigen Updates und Wartungsverträgen. Es MUSS festgelegt werden, wo die Geräte aufgestellt werden dürfen. Außerdem MUSS festgelegt sein, wer auf die Drucker, Kopierer und Multifunktionsgeräte zugreifen darf. Die Ergebnisse SOLLTEN in einem Basiskonzept dokumentiert werden."
SYS.4.1.A10,SYS.4.1,"Drucker, Kopierer und",ENTFALLEN,S,Standard,,True,Diese Anforderung ist entfallen.
SYS.4.1.A11,SYS.4.1,"Drucker, Kopierer und","Einschränkung der Anbindung von Druckern, Kopierern und Multifunktionsgeräten",S,Standard,,False,"Der IT-Betrieb SOLLTE sicherstellen, dass netzfähige Drucker, Kopierer und Multifunktionsgeräte nicht aus Fremdnetzen erreichbar sind. Wenn Multifunktionsgeräte an das Telefonnetz angeschlossen werden, SOLLTE sichergestellt werden, dass keine unkontrollierten Datenverbindungen zwischen dem Datennetz der Institution und dem Telefonnetz aufgebaut werden können. Netzdrucker und Multifunktionsgeräte SOLLTEN in einem eigenen Netzsegment, das von den Clients und Servern der Institution getrennt ist, betrieben werden."
SYS.4.1.A12,SYS.4.1,"Drucker, Kopierer und",ENTFALLEN,B,Basis,,True,Diese Anforderung ist entfallen.
SYS.4.1.A13,SYS.4.1,"Drucker, Kopierer und",ENTFALLEN,B,Basis,,True,Diese Anforderung ist entfallen.
SYS.4.1.A14,SYS.4.1,"Drucker, Kopierer und","Authentisierung und Autorisierung bei Druckern, Kopierern und Multifunktionsgeräten",H,Erhöhter Schutzbedarf,,False,"Nur berechtigte Personen SOLLTEN auf die ausgedruckten oder kopierten Dokumente zugreifen können. Es SOLLTEN möglichst nur zentrale Drucker, Kopierer und Multifunktionsgeräte eingesetzt werden, bei denen sich die Benutzenden am Gerät authentisieren, bevor der Druckauftrag startet („Secure-Print“). Nachdem sich die Benutzenden authentisiert haben, SOLLTEN ausschließlich nur die eigenen Druckaufträge sichtbar sein. Nur die für die jeweiligen Benutzenden notwendigen Funktionen SOLLTEN freigeschaltet werden."
SYS.4.1.A15,SYS.4.1,"Drucker, Kopierer und","Verschlüsselung von Informationen bei Druckern, Kopierern und Multifunktionsgeräten",S,Standard,,False,"Wenn möglich, SOLLTEN alle auf geräteinternen, nichtflüchtigen Speichermedien abgelegten Informationen verschlüsselt werden. Auch Druckaufträge SOLLTEN möglichst verschlüsselt übertragen werden."
SYS.4.1.A16,SYS.4.1,"Drucker, Kopierer und","Verringerung von Ausfallzeiten bei Druckern, Kopierern und Multifunktionsgeräten",H,Erhöhter Schutzbedarf,,False,"Um die Ausfallzeiten von Druckern, Kopierern und Multifunktionsgeräten so gering wie möglich zu halten, SOLLTEN unter anderem • Ersatzgeräte bereitstehen, • in Wartungsverträgen auf eine angemessene Reaktionszeit geachtet werden, • eine Liste mit Fachhandlungen geführt werden, um schnell Ersatzgeräte oder -teile beschaffen zu können und • falls erforderlich, häufig benötigte Ersatzteile gelagert werden."
SYS.4.1.A17,SYS.4.1,"Drucker, Kopierer und",Schutz von Nutz- und Metadaten,S,Standard,,False,"Nutz- und Metadaten wie Druckaufträge und Scandateien SOLLTEN nur so kurz wie möglich auf den Geräten gespeichert werden. Die Daten SOLLTEN nach einer vordefinierten Zeit automatisch gelöscht werden. Dateiserver in den Geräten und Funktionen wie „Scan in den Gerätespeicher"" SOLLTEN vom IT-Betrieb abgeschaltet werden. Die dafür benötigten Protokolle und Funktionen SOLLTEN, soweit möglich, gesperrt werden. Generell SOLLTE vom IT-Betrieb sichergestellt werden, dass alle Metadaten nicht für Unberechtigte sichtbar sind. Es SOLLTE von der Institution geregelt werden, wie mit Metadaten versehene Ausdrucke an Dritte weitergegeben werden."
SYS.4.1.A18,SYS.4.1,"Drucker, Kopierer und","Konfiguration von Druckern, Kopierern und Multifunktionsgeräten",S,Standard,,False,"Alle Drucker und Multifunktionsgeräte SOLLTEN nur vom IT-Betrieb konfiguriert werden können. Nicht benötigte Gerätefunktionen SOLLTEN abgeschaltet werden. Insbesondere SOLLTEN alle nicht benötigten Daten- und Netzschnittstellen von Druckern, Kopierern und Multifunktionsgeräten deaktiviert werden. Die Geräte SOLLTEN ausschließlich über verschlüsselte Protokolle wie HTTPS und SNMPv3 verwaltet werden. Sämtliche Protokolle, mit denen unverschlüsselt auf Drucker und Multifunktionsgeräte zugegriffen werden kann, SOLLTEN vom IT-Betrieb durch verschlüsselte ersetzt oder abgeschaltet werden. Das SOLLTE insbesondere für Protokolle umgesetzt werden, mit denen sich die Gerätekonfiguration verändern lässt, z. B. SNMP, Telnet und PJL."
SYS.4.1.A19,SYS.4.1,"Drucker, Kopierer und",ENTFALLEN,S,Standard,,True,Diese Anforderung ist entfallen.
SYS.4.1.A2,SYS.4.1,"Drucker, Kopierer und","Geeignete Aufstellung und Zugriff auf Drucker, Kopierer und Multifunktionsgeräte",B,Basis,,False,"Der IT-Betrieb MUSS Drucker, Kopierer und Multifunktionsgeräte so aufstellen und absichern, dass nur befugte Personen die Geräte verwenden und auf verarbeitete Informationen zugreifen können. Außerdem MUSS sichergestellt sein, dass nur berechtigte Personen die Geräte administrieren, warten und reparieren können. Mit Dienstleistenden (z. B. für die Wartung) MÜSSEN schriftliche Vertraulichkeitsvereinbarungen getroffen werden. Drucker, Kopierer und Multifunktionsgeräte MÜSSEN mit Gerätepasswörtern versehen sein, um so den Zugriff auf Webserver und Bedienfeld für die Administration zu sperren. Diese MÜSSEN die Vorgaben des Identitäts- und Berechtigungsmanagements der Institution erfüllen."
SYS.4.1.A20,SYS.4.1,"Drucker, Kopierer und","Erweiterter Schutz von Informationen bei Druckern, Kopierern und Multifunktionsgeräten",H,Erhöhter Schutzbedarf,,False,"Es SOLLTEN auf dem Druckserver die Namen der Druckaufträge nur anonymisiert angezeigt werden. Alle Schnittstellen für externe Speichermedien SOLLTEN gesperrt werden. Weiterhin SOLLTEN geräteinterne Adressbücher deaktiviert und den Benutzenden alternative Adressierungsverfahren (z. B. Adresssuche per LDAP) angeboten werden. Bei Druckern und Multifunktionsgeräten mit E-Mail-Funktion SOLLTE sichergestellt sein, dass E- Mails ausschließlich mit den E-Mail-Adressen der authentisierten Benutzenden versendet werden können. Auch SOLLTEN Dokumente nur an interne E-Mail-Adressen verschickt werden können. Eingehende Fax-Dokumente sowie Sendeberichte SOLLTEN nur autorisierten Personen zugänglich sein."
SYS.4.1.A21,SYS.4.1,"Drucker, Kopierer und","Erweiterte Absicherung von Druckern, Kopierern und Multifunktionsgeräten",H,Erhöhter Schutzbedarf,,False,"Der IT-Betrieb SOLLTE die Sicherheitseinstellungen von Druckern, Kopierern und Multifunktionsgeräten regelmäßig kontrollieren und, falls notwendig, korrigieren. Wenn ein automatisiertes Kontroll- und Korrektursystem verfügbar ist, SOLLTE es genutzt werden. Zudem SOLLTE eingeschränkt werden, dass die Geräte über das Bootmenü auf die Werkseinstellungen zurückgestellt werden können. Es SOLLTE sichergestellt sein, dass keine Firmware oder Zusatzsoftware auf Druckern und Multifunktionsgeräten installiert werden kann, die nicht von den jeweiligen Herstellenden verifiziert und freigegeben wurde."
SYS.4.1.A22,SYS.4.1,"Drucker, Kopierer und",Ordnungsgemäße Entsorgung ausgedruckter Dokumente,B,Basis,,False,"Nicht benötigte, aber ausgedruckte Dokumente mit vertraulichen Informationen MÜSSEN in geeigneter Weise vernichtet werden. Sind Heimarbeitsplätze mit Druckern, Kopierern oder Multifunktionsgeräten ausgestattet, SOLLTE gewährleistet werden, dass die ausgedruckten Informationen auch direkt vor Ort geeignet vernichtet werden können, wenn sie nicht mehr benötigt werden."
SYS.4.1.A3,SYS.4.1,"Drucker, Kopierer und",ENTFALLEN,B,Basis,,True,Diese Anforderung ist entfallen.
SYS.4.1.A4,SYS.4.1,"Drucker, Kopierer und","Erstellung einer Sicherheitsrichtlinie für den Einsatz von Druckern, Kopierern und Multifunktionsgeräten",S,Standard,,False,"Die Institution SOLLTE eine Sicherheitsrichtlinie für Drucker, Kopierer und Multifunktionsgeräte entwickeln. Darin SOLLTE geregelt werden, welche Anforderungen und Vorgaben an die Informationssicherheit der Geräte gestellt und wie diese erfüllt werden sollen. Es SOLLTE auch festgelegt werden, welche Funktionen von welchen Benutzenden unter welchen Bedingungen administriert beziehungsweise genutzt werden dürfen."
SYS.4.1.A5,SYS.4.1,"Drucker, Kopierer und","Erstellung von Nutzungsrichtlinien für den Umgang mit Druckern, Kopierern und Multifunktionsgeräten",S,Standard,"Informationssicherheitsbeauftragte
(ISB)",False,"Für die Institution SOLLTE der oder die ISB eine Nutzungsrichtlinie erstellen, auf der alle Sicherheitsvorgaben zum Umgang mit den Geräten übersichtlich und verständlich zusammengefasst sind. Die Nutzungsrichtlinie SOLLTE allen Benutzenden bekannt sein."
SYS.4.1.A6,SYS.4.1,"Drucker, Kopierer und",ENTFALLEN,S,Standard,,True,Diese Anforderung ist entfallen.
SYS.4.1.A7,SYS.4.1,"Drucker, Kopierer und","Beschränkung der administrativen Fernzugriffe auf Drucker, Kopierer und Multifunktionsgeräte",S,Standard,,False,"Der IT-Betrieb SOLLTE sicherstellen, dass der administrative Fernzugriff auf Drucker, Kopierer und Multifunktionsgeräte nur einer klar definierten Gruppe des Administrations- und Servicepersonals ermöglicht wird. Das SOLLTE auch dann gewährleistet sein, wenn die Institution eine zentrale Geräteverwaltungssoftware einsetzt. Es SOLLTE festgelegt werden, ob die Anzeige des Bedienfelds über ein Datennetz eingesehen werden darf. Wenn dies gewünscht ist, SOLLTE es nur an den IT-Betrieb übertragen werden können. Auch SOLLTE dies mit den betroffenen Benutzenden abgestimmt sein."
SYS.4.1.A8,SYS.4.1,"Drucker, Kopierer und",ENTFALLEN,S,Standard,,True,Diese Anforderung ist entfallen.
SYS.4.1.A9,SYS.4.1,"Drucker, Kopierer und",ENTFALLEN,S,Standard,,True,Diese Anforderung ist entfallen.
SYS.4.3.A1,SYS.4.3,Eingebettete Systeme,Regelungen zum Umgang mit eingebetteten Systemen,B,Basis,,False,"Alle Benutzenden und Administrierende MÜSSEN über Verhaltensregeln und Meldewege bei Ausfällen, Fehlfunktionen oder bei Verdacht auf einen Sicherheitsvorfall informiert sein. Alle eingebetteten Systeme inklusive Schnittstellen MÜSSEN erfasst werden. Die eingebetteten Systeme MÜSSEN sicher vorkonfiguriert werden. Die vorgenommene Konfiguration SOLLTE dokumentiert sein. Weiterhin SOLLTEN Regelungen festgelegt werden, um die Integrität und Funktionsfähigkeit der eingebetteten Systeme zu testen."
SYS.4.3.A10,SYS.4.3,Eingebettete Systeme,Wiederherstellung von eingebetteten Systemen,S,Standard,,False,Eingebettete Systeme SOLLTEN über Rollback-Fähigkeiten verfügen.
SYS.4.3.A11,SYS.4.3,Eingebettete Systeme,Sichere Aussonderung eines eingebetteten Systems,S,Standard,,False,"Bevor eingebettete Systeme ausgesondert werden, SOLLTEN sämtliche Daten auf dem System sicher gelöscht werden. Ist dies nicht möglich, SOLLTE das System vernichtet werden. Die Löschung oder Vernichtung SOLLTE dokumentiert werden."
